{
 "schema_version": "1.0",
 "item": "MG-034",
 "tool": "qc.py",
 "tool_version": "1.0.0",
 "generatedAt": "2026-10-15T08:52:07.988543+00:00",
 "mode": "package",
 "job_id": "fixture-standalone-silent",
 "artifact_path": "renders/final.mp4",
 "artifact_sha256": "142d44a2d5afb5a56b5dd41d5f57f51a5053ab581747e987645200fe464b30f4",
 "artifact_bytes": 437478,
 "verdict": "pass",
 "exit_code": 0,
 "first_error_category": null,
 "plan": {
  "job_id": "fixture-standalone-silent",
  "fps": 30,
  "total_frames": 405,
  "total_samples": 648000,
  "canvas": [
   1920,
   1080
  ],
  "audio_mode": "none",
  "video_profile": "h264_opaque"
 },
 "inputs": {
  "manifest": {
   "path": "/home/hatch/workspace/skill72-v2/wt-mg044/.scratch/mg044-standalone/stage/job/manifest.json",
   "sha256": "bea7fb538a65cd9b78223fcfb536939d23ef36b361861f1cf4a8dd8da51d6ae1"
  },
  "plan": {
   "path": "/home/hatch/workspace/skill72-v2/wt-mg044/.scratch/mg044-standalone/stage/job/timeline.json",
   "sha256": "72818c8ac62847371ea5924296db7d43789d7c1bc457f4e0ae2b2b9cc2e2920f"
  },
  "sidecar": {
   "path": "/home/hatch/workspace/skill72-v2/wt-mg044/.scratch/mg044-standalone/stage/job/timeline-sidecar.json",
   "sha256": "b72b24e048092ff73c6243d24ca5593d059aaba32d90798e21c63c21d40d425b"
  },
  "media": {
   "path": "/home/hatch/workspace/skill72-v2/wt-mg044/.scratch/mg044-standalone/stage/job/media.json",
   "sha256": "26c4990caeadff751642c0a46625bb134c373f71fdd044a1837a53452c352364"
  },
  "coverage": {
   "path": "/home/hatch/workspace/skill72-v2/wt-mg044/.scratch/mg044-standalone/stage/job/review/fixture-standalone-silent__coverage.json",
   "sha256": "77b9a0121c479575578dd354556ebf439bc33b4111f9d10e645be2c352b63859"
  },
  "assets": {
   "path": "/home/hatch/workspace/skill72-v2/wt-mg044/.scratch/mg044-standalone/stage/job/assets.json",
   "sha256": "0f308f178d2536c9416d53cc7d8e070e04b3aac2c999996de75c9dba2fe1ca95"
  }
 },
 "checks": [
  {
   "id": "tools.available",
   "title": "ffmpeg and ffprobe are runnable",
   "mandatory": true,
   "status": "PASS",
   "code": null,
   "category": null,
   "message": "ffmpeg and ffprobe both answered -version with exit 0",
   "command": "ffmpeg -version; ffprobe -version",
   "exit_status": [
    0,
    0
   ],
   "observed": {
    "ffmpeg": "ffmpeg version 8.1.2 Copyright (c) 2000-2026 the FFmpeg developers",
    "ffprobe": "ffprobe version 8.1.2 Copyright (c) 2007-2026 the FFmpeg developers",
    "tool_paths": {
     "ffmpeg": "/usr/bin/ffmpeg",
     "ffprobe": "/usr/bin/ffprobe"
    }
   },
   "evidence": "/home/hatch/workspace/skill72-v2/wt-mg044/.scratch/mg044-standalone/stage/job/timeline.json"
  },
  {
   "id": "inputs.plan",
   "title": "planned truth loads and agrees",
   "mandatory": true,
   "status": "PASS",
   "code": null,
   "category": null,
   "message": "compiled timeline and sidecar agree on fps, totals, and job id; MG-023 resolved audio mode none",
   "command": null,
   "exit_status": null,
   "observed": {
    "job_id": "fixture-standalone-silent",
    "fps": 30,
    "total_frames": 405,
    "total_samples": 648000,
    "duration_seconds": 13.5,
    "audio_mode": "none",
    "audio_owner": "none",
    "loudness_target": null,
    "job_ids": {
     "timeline": "fixture-standalone-silent",
     "sidecar": "fixture-standalone-silent",
     "manifest": "fixture-standalone-silent",
     "media": null
    }
   },
   "evidence": "/home/hatch/workspace/skill72-v2/wt-mg044/.scratch/mg044-standalone/stage/job/timeline.json"
  },
  {
   "id": "artifact.exists",
   "title": "final artifact exists",
   "mandatory": true,
   "status": "PASS",
   "code": null,
   "category": null,
   "message": "final artifact present at 437478 bytes",
   "command": null,
   "exit_status": null,
   "observed": {
    "path": "/home/hatch/workspace/skill72-v2/wt-mg044/.scratch/mg044-standalone/stage/job/renders/final.mp4",
    "bytes": 437478
   },
   "evidence": "/home/hatch/workspace/skill72-v2/wt-mg044/.scratch/mg044-standalone/stage/job/renders/final.mp4"
  },
  {
   "id": "artifact.hash",
   "title": "artifact sha256 recorded",
   "mandatory": true,
   "status": "PASS",
   "code": null,
   "category": null,
   "message": "sha256 of the exact bytes under review is recorded in the report header and binds every other record",
   "command": null,
   "exit_status": null,
   "observed": {
    "sha256": "142d44a2d5afb5a56b5dd41d5f57f51a5053ab581747e987645200fe464b30f4",
    "bytes": 437478
   },
   "evidence": "/home/hatch/workspace/skill72-v2/wt-mg044/.scratch/mg044-standalone/stage/job/renders/final.mp4"
  },
  {
   "id": "artifact.probe",
   "title": "artifact probes cleanly",
   "mandatory": true,
   "status": "PASS",
   "code": null,
   "category": null,
   "message": "ffprobe parsed the container and found a video stream",
   "command": "ffprobe -v error -show_streams -show_format -of json /home/hatch/workspace/skill72-v2/wt-mg044/.scratch/mg044-standalone/stage/job/renders/final.mp4",
   "exit_status": 0,
   "observed": {
    "streams": [
     {
      "index": 0,
      "codec_type": "video",
      "codec_name": "h264"
     }
    ],
    "format": "mov,mp4,m4a,3gp,3g2,mj2"
   },
   "evidence": "/home/hatch/workspace/skill72-v2/wt-mg044/.scratch/mg044-standalone/stage/job/renders/final.mp4"
  },
  {
   "id": "artifact.decode",
   "title": "artifact decodes end to end",
   "mandatory": true,
   "status": "PASS",
   "code": null,
   "category": null,
   "message": "every stream decoded to the end with no error",
   "command": "ffmpeg -v error -i /home/hatch/workspace/skill72-v2/wt-mg044/.scratch/mg044-standalone/stage/job/renders/final.mp4 -f null -",
   "exit_status": 0,
   "observed": {
    "error_lines": []
   },
   "evidence": "/home/hatch/workspace/skill72-v2/wt-mg044/.scratch/mg044-standalone/stage/job/renders/final.mp4"
  },
  {
   "id": "plan.dimensions",
   "title": "final dimensions match the plan canvas",
   "mandatory": true,
   "status": "PASS",
   "code": null,
   "category": null,
   "message": "artifact dimensions equal the plan canvas 1920x1080",
   "command": null,
   "exit_status": null,
   "observed": {
    "expected": {
     "width": 1920,
     "height": 1080,
     "aspect": 1.7778,
     "source": "manifest.canvas"
    },
    "observed": {
     "width": 1920,
     "height": 1080,
     "aspect": 1.7778
    }
   },
   "evidence": "/home/hatch/workspace/skill72-v2/wt-mg044/.scratch/mg044-standalone/stage/job/renders/final.mp4"
  },
  {
   "id": "plan.fps",
   "title": "final fps matches the plan",
   "mandatory": true,
   "status": "PASS",
   "code": null,
   "category": null,
   "message": "artifact frame rate matches the compiled plan",
   "command": null,
   "exit_status": null,
   "observed": {
    "expected_fps": 30.0,
    "observed_fps": 30.0,
    "avg_frame_rate": "30/1"
   },
   "evidence": "/home/hatch/workspace/skill72-v2/wt-mg044/.scratch/mg044-standalone/stage/job/renders/final.mp4"
  },
  {
   "id": "plan.frame_count",
   "title": "decoded frame count matches the plan",
   "mandatory": true,
   "status": "PASS",
   "code": null,
   "category": null,
   "message": "decoded frame count equals the compiled total",
   "command": "ffprobe -v error -show_streams -show_format -of json -count_frames /home/hatch/workspace/skill72-v2/wt-mg044/.scratch/mg044-standalone/stage/job/renders/final.mp4",
   "exit_status": 0,
   "observed": {
    "expected_frames": 405,
    "decoded_frames": 405
   },
   "evidence": "/home/hatch/workspace/skill72-v2/wt-mg044/.scratch/mg044-standalone/stage/job/renders/final.mp4"
  },
  {
   "id": "plan.duration",
   "title": "final duration matches the compiled duration",
   "mandatory": true,
   "status": "PASS",
   "code": null,
   "category": null,
   "message": "artifact duration is within 0.12s of the compiled duration",
   "command": null,
   "exit_status": null,
   "observed": {
    "expected_seconds": 13.5,
    "observed_seconds": 13.5,
    "tolerance_seconds": 0.12
   },
   "evidence": "/home/hatch/workspace/skill72-v2/wt-mg044/.scratch/mg044-standalone/stage/job/renders/final.mp4"
  },
  {
   "id": "plan.streams",
   "title": "stream inventory matches the plan",
   "mandatory": true,
   "status": "PASS",
   "code": null,
   "category": null,
   "message": "stream inventory matches the resolved plan",
   "command": null,
   "exit_status": null,
   "observed": {
    "expected_audio": false,
    "observed_audio": false,
    "audio_mode": "none",
    "streams": [
     {
      "index": 0,
      "codec_type": "video",
      "codec_name": "h264"
     }
    ]
   },
   "evidence": "/home/hatch/workspace/skill72-v2/wt-mg044/.scratch/mg044-standalone/stage/job/renders/final.mp4"
  },
  {
   "id": "audio.decode",
   "title": "final audio decodes for measurement",
   "mandatory": true,
   "status": "SKIPPED_WITH_REASON",
   "code": null,
   "category": null,
   "message": "the artifact has no audio stream; there is no audio to decode (plan.streams judges whether that absence is correct)",
   "command": null,
   "exit_status": null,
   "observed": {
    "audio_stream": null
   },
   "evidence": "/home/hatch/workspace/skill72-v2/wt-mg044/.scratch/mg044-standalone/stage/job/renders/final.mp4"
  },
  {
   "id": "audio.duration",
   "title": "audio length matches the compiled total samples",
   "mandatory": true,
   "status": "SKIPPED_WITH_REASON",
   "code": null,
   "category": null,
   "message": "no audio stream to measure; plan.streams judges whether the plan expected one",
   "command": null,
   "exit_status": null,
   "observed": {
    "audio_stream": null
   },
   "evidence": "/home/hatch/workspace/skill72-v2/wt-mg044/.scratch/mg044-standalone/stage/job/timeline.json"
  },
  {
   "id": "audio.clipping",
   "title": "encoded audio does not clip",
   "mandatory": true,
   "status": "SKIPPED_WITH_REASON",
   "code": null,
   "category": null,
   "message": "no audio stream; nothing can clip",
   "command": null,
   "exit_status": null,
   "observed": {